GO Term,Description,P-value,FDR q-value,Enrichment,N,B,n,b,GenesGO:0030198,extracellular matrix organization,7.66E-10,8.54E-06,2.65,8230,270,586,51,"[FMOD  -  fibromodulin, ELN  -  elastin, COL14A1  -  collagen, type xiv, alpha 1, CD151  -  cd151 molecule (raph blood group), LGALS3  -  lectin, galactoside-binding, soluble, 3, FBLN1  -  fibulin 1, CTSK  -  cathepsin k, BGN  -  biglycan, FOXC1  -  forkhead box c1, CTSD  -  cathepsin d, P4HB  -  prolyl 4-hydroxylase, beta polypeptide, SOX9  -  sry (sex determining region y)-box 9, FOXF2  -  forkhead box f2, DDR1  -  discoidin domain receptor tyrosine kinase 1, MMP11  -  matrix metallopeptidase 11 (stromelysin 3), FURIN  -  furin (paired basic amino acid cleaving enzyme), BMP1  -  bone morphogenetic protein 1, VCAM1  -  vascular cell adhesion molecule 1, SERPINE1  -  serpin peptidase inhibitor, clade e (nexin, plasminogen activator inhibitor type 1), member 1, APP  -  amyloid beta (a4) precursor protein, PLEC  -  plectin, SERPINF2  -  serpin peptidase inhibitor, clade f (alpha-2 antiplasmin, pigment epithelium derived factor), member 2, BMP4  -  bone morphogenetic protein 4, TNFRSF11B  -  tumor necrosis factor receptor superfamily, member 11b, PDGFA  -  platelet-derived growth factor alpha polypeptide, ITGA5  -  integrin, alpha 5 (fibronectin receptor, alpha polypeptide), ACTN1  -  actinin, alpha 1, ITGA7  -  integrin, alpha 7, RECK  -  reversion-inducing-cysteine-rich protein with kazal motifs, MFAP5  -  microfibrillar associated protein 5, PDGFRA  -  platelet-derived growth factor receptor, alpha polypeptide, ITGA3  -  integrin, alpha 3 (antigen cd49c, alpha 3 subunit of vla-3 receptor), ITGB5  -  integrin, beta 5, FBLN5  -  fibulin 5, LUM  -  lumican, NID2  -  nidogen 2 (osteonidogen), COL8A1  -  collagen, type viii, alpha 1, TGFB1  -  transforming growth factor, beta 1, COL4A5  -  collagen, type iv, alpha 5, DAG1  -  dystroglycan 1 (dystrophin-associated glycoprotein 1), MFAP4  -  microfibrillar-associated protein 4, DMD  -  dystrophin, LAMA5  -  laminin, alpha 5, EFEMP1  -  egf containing fibulin-like extracellular matrix protein 1, PRKCA  -  protein kinase c, alpha, LAMA4  -  laminin, alpha 4, COL11A1  -  collagen, type xi, alpha 1, GAS6  -  growth arrest-specific 6, ITGA6  -  integrin, alpha 6, FBLN2  -  fibulin 2, LAMB1  -  laminin, beta 1]"GO:0043062,extracellular structure organization,7.66E-10,4.27E-06,2.65,8230,270,586,51,"[FMOD  -  fibromodulin, ELN  -  elastin, COL14A1  -  collagen, type xiv, alpha 1, CD151  -  cd151 molecule (raph blood group), LGALS3  -  lectin, galactoside-binding, soluble, 3, FBLN1  -  fibulin 1, CTSK  -  cathepsin k, BGN  -  biglycan, FOXC1  -  forkhead box c1, CTSD  -  cathepsin d, P4HB  -  prolyl 4-hydroxylase, beta polypeptide, SOX9  -  sry (sex determining region y)-box 9, FOXF2  -  forkhead box f2, DDR1  -  discoidin domain receptor tyrosine kinase 1, MMP11  -  matrix metallopeptidase 11 (stromelysin 3), FURIN  -  furin (paired basic amino acid cleaving enzyme), BMP1  -  bone morphogenetic protein 1, VCAM1  -  vascular cell adhesion molecule 1, SERPINE1  -  serpin peptidase inhibitor, clade e (nexin, plasminogen activator inhibitor type 1), member 1, APP  -  amyloid beta (a4) precursor protein, PLEC  -  plectin, SERPINF2  -  serpin peptidase inhibitor, clade f (alpha-2 antiplasmin, pigment epithelium derived factor), member 2, BMP4  -  bone morphogenetic protein 4, TNFRSF11B  -  tumor necrosis factor receptor superfamily, member 11b, PDGFA  -  platelet-derived growth factor alpha polypeptide, ITGA5  -  integrin, alpha 5 (fibronectin receptor, alpha polypeptide), ACTN1  -  actinin, alpha 1, ITGA7  -  integrin, alpha 7, RECK  -  reversion-inducing-cysteine-rich protein with kazal motifs, MFAP5  -  microfibrillar associated protein 5, PDGFRA  -  platelet-derived growth factor receptor, alpha polypeptide, ITGA3  -  integrin, alpha 3 (antigen cd49c, alpha 3 subunit of vla-3 receptor), ITGB5  -  integrin, beta 5, FBLN5  -  fibulin 5, LUM  -  lumican, NID2  -  nidogen 2 (osteonidogen), COL8A1  -  collagen, type viii, alpha 1, TGFB1  -  transforming growth factor, beta 1, COL4A5  -  collagen, type iv, alpha 5, DAG1  -  dystroglycan 1 (dystrophin-associated glycoprotein 1), MFAP4  -  microfibrillar-associated protein 4, DMD  -  dystrophin, LAMA5  -  laminin, alpha 5, EFEMP1  -  egf containing fibulin-like extracellular matrix protein 1, PRKCA  -  protein kinase c, alpha, LAMA4  -  laminin, alpha 4, COL11A1  -  collagen, type xi, alpha 1, GAS6  -  growth arrest-specific 6, ITGA6  -  integrin, alpha 6, FBLN2  -  fibulin 2, LAMB1  -  laminin, beta 1]"GO:0060548,negative regulation of cell death,4.19E-08,1.56E-04,1.75,8230,554,892,105,"[BNIP3  -  bcl2/adenovirus e1b 19kda interacting protein 3, DDX3X  -  dead (asp-glu-ala-asp) box helicase 3, x-linked, BNIP2  -  bcl2/adenovirus e1b 19kda interacting protein 2, NCK1  -  nck adaptor protein 1, MIF  -  macrophage migration inhibitory factor (glycosylation-inhibiting factor), PAX7  -  paired box 7, HTRA2  -  htra serine peptidase 2, CD59  -  cd59 molecule, complement regulatory protein, PSMA1  -  proteasome (prosome, macropain) subunit, alpha type, 1, HRAS  -  harvey rat sarcoma viral oncogene homolog, FOXO1  -  forkhead box o1, ASIC2  -  acid-sensing (proton-gated) ion channel 2, FOXC1  -  forkhead box c1, PSMA6  -  proteasome (prosome, macropain) subunit, alpha type, 6, CRLF1  -  cytokine receptor-like factor 1, PSMB10  -  proteasome (prosome, macropain) subunit, beta type, 10, PDCD10  -  programmed cell death 10, SOX9  -  sry (sex determining region y)-box 9, PSMB9  -  proteasome (prosome, macropain) subunit, beta type, 9, SOX4  -  sry (sex determining region y)-box 4, PSMB8  -  proteasome (prosome, macropain) subunit, beta type, 8, NACA  -  nascent polypeptide-associated complex alpha subunit, PSMB4  -  proteasome (prosome, macropain) subunit, beta type, 4, APOE  -  apolipoprotein e, SOD2  -  superoxide dismutase 2, mitochondrial, SOD1  -  superoxide dismutase 1, soluble, SERPINE1  -  serpin peptidase inhibitor, clade e (nexin, plasminogen activator inhibitor type 1), member 1, PSMD8  -  proteasome (prosome, macropain) 26s subunit, non-atpase, 8, IL6ST  -  interleukin 6 signal transducer (gp130, oncostatin m receptor), BMP4  -  bone morphogenetic protein 4, AQP1  -  aquaporin 1 (colton blood group), ITGA5  -  integrin, alpha 5 (fibronectin receptor, alpha polypeptide), PSMD11  -  proteasome (prosome, macropain) 26s subunit, non-atpase, 11, PSME1  -  proteasome (prosome, macropain) activator subunit 1 (pa28 alpha), MDK  -  midkine (neurite growth-promoting factor 2), CFL1  -  cofilin 1 (non-muscle), MECP2  -  methyl cpg binding protein 2 (rett syndrome), ADAR  -  adenosine deaminase, rna-specific, PDPK1  -  3-phosphoinositide dependent protein kinase-1, FGF2  -  fibroblast growth factor 2 (basic), EGFR  -  epidermal growth factor receptor, HTR2B  -  5-hydroxytryptamine (serotonin) receptor 2b, g protein-coupled, FGF4  -  fibroblast growth factor 4, ADA  -  adenosine deaminase, ARHGDIA  -  rho gdp dissociation inhibitor (gdi) alpha, MED1  -  mediator complex subunit 1, CEBPB  -  ccaat/enhancer binding protein (c/ebp), beta, AMIGO2  -  adhesion molecule with ig-like domain 2, KRT18  -  keratin 18, ROCK1  -  rho-associated, coiled-coil containing protein kinase 1, DAPK1  -  death-associated protein kinase 1, MAPK8IP1  -  mitogen-activated protein kinase 8 interacting protein 1, TCF7L2  -  transcription factor 7-like 2 (t-cell specific, hmg-box), EDNRA  -  endothelin receptor type a, TRAF2  -  tnf receptor-associated factor 2, HDAC1  -  histone deacetylase 1, TPT1  -  tumor protein, translationally-controlled 1, IRAK1  -  interleukin-1 receptor-associated kinase 1, IFIT3  -  interferon-induced protein with tetratricopeptide repeats 3, TLE1  -  transducin-like enhancer of split 1 (e(sp1) homolog, drosophila), AGT  -  angiotensinogen (serpin peptidase inhibitor, clade a, member 8), GPI  -  glucose-6-phosphate isomerase, UNG  -  uracil-dna glycosylase, CAST  -  calpastatin, CTSH  -  cathepsin h, ID1  -  inhibitor of dna binding 1, dominant negative helix-loop-helix protein, NGF  -  nerve growth factor (beta polypeptide), NFKBIA  -  nuclear factor of kappa light polypeptide gene enhancer in b-cells inhibitor, alpha, WNT5A  -  wingless-type mmtv integration site family, member 5a, TSC22D3  -  tsc22 domain family, member 3, TEK  -  tek tyrosine kinase, endothelial, MSH2  -  muts homolog 2, colon cancer, nonpolyposis type 1 (e. coli), SHH  -  sonic hedgehog, BAG1  -  bcl2-associated athanogene, JUN  -  jun proto-oncogene, GPX1  -  glutathione peroxidase 1, STAT3  -  signal transducer and activator of transcription 3 (acute-phase response factor), PRNP  -  prion protein, CRYAB  -  crystallin, alpha b, ARNT2  -  aryl-hydrocarbon receptor nuclear translocator 2, CCNG1  -  cyclin g1, ATF5  -  activating transcription factor 5, NFE2L2  -  nuclear factor (erythroid-derived 2)-like 2, JAK2  -  janus kinase 2, TYRO3  -  tyro3 protein tyrosine kinase, RPS6KA3  -  ribosomal protein s6 kinase, 90kda, polypeptide 3, SFRP1  -  secreted frizzled-related protein 1, IGF1R  -  insulin-like growth factor 1 receptor, MAPK7  -  mitogen-activated protein kinase 7, SERPINB9  -  serpin peptidase inhibitor, clade b (ovalbumin), member 9, CAT  -  catalase, FADD  -  fas (tnfrsf6)-associated via death domain, BCL6  -  b-cell cll/lymphoma 6, KRIT1  -  krit1, ankyrin repeat containing, CFDP1  -  craniofacial development protein 1, PRKCG  -  protein kinase c, gamma, SLC25A4  -  solute carrier family 25 (mitochondrial carrier; adenine nucleotide translocator), member 4, SMAD3  -  smad family member 3, PRKCA  -  protein kinase c, alpha, SMAD6  -  smad family member 6, GSK3B  -  glycogen synthase kinase 3 beta, CBS  -  cystathionine-beta-synthase, GAS6  -  growth arrest-specific 6, ITSN1  -  intersectin 1 (sh3 domain protein), GAS1  -  growth arrest-specific 1]"GO:0043069,negative regulation of programmed cell death,1.10E-07,3.07E-04,1.75,8230,528,892,100,"[BNIP3  -  bcl2/adenovirus e1b 19kda interacting protein 3, DDX3X  -  dead (asp-glu-ala-asp) box helicase 3, x-linked, BNIP2  -  bcl2/adenovirus e1b 19kda interacting protein 2, MIF  -  macrophage migration inhibitory factor (glycosylation-inhibiting factor), PAX7  -  paired box 7, CD59  -  cd59 molecule, complement regulatory protein, PSMA1  -  proteasome (prosome, macropain) subunit, alpha type, 1, HRAS  -  harvey rat sarcoma viral oncogene homolog, FOXO1  -  forkhead box o1, ASIC2  -  acid-sensing (proton-gated) ion channel 2, FOXC1  -  forkhead box c1, PSMA6  -  proteasome (prosome, macropain) subunit, alpha type, 6, CRLF1  -  cytokine receptor-like factor 1, PSMB10  -  proteasome (prosome, macropain) subunit, beta type, 10, PDCD10  -  programmed cell death 10, SOX9  -  sry (sex determining region y)-box 9, PSMB9  -  proteasome (prosome, macropain) subunit, beta type, 9, PSMB8  -  proteasome (prosome, macropain) subunit, beta type, 8, NACA  -  nascent polypeptide-associated complex alpha subunit, PSMB4  -  proteasome (prosome, macropain) subunit, beta type, 4, APOE  -  apolipoprotein e, SOD2  -  superoxide dismutase 2, mitochondrial, SOD1  -  superoxide dismutase 1, soluble, SERPINE1  -  serpin peptidase inhibitor, clade e (nexin, plasminogen activator inhibitor type 1), member 1, PSMD8  -  proteasome (prosome, macropain) 26s subunit, non-atpase, 8, IL6ST  -  interleukin 6 signal transducer (gp130, oncostatin m receptor), BMP4  -  bone morphogenetic protein 4, AQP1  -  aquaporin 1 (colton blood group), ITGA5  -  integrin, alpha 5 (fibronectin receptor, alpha polypeptide), PSMD11  -  proteasome (prosome, macropain) 26s subunit, non-atpase, 11, PSME1  -  proteasome (prosome, macropain) activator subunit 1 (pa28 alpha), MDK  -  midkine (neurite growth-promoting factor 2), CFL1  -  cofilin 1 (non-muscle), MECP2  -  methyl cpg binding protein 2 (rett syndrome), ADAR  -  adenosine deaminase, rna-specific, PDPK1  -  3-phosphoinositide dependent protein kinase-1, EGFR  -  epidermal growth factor receptor, HTR2B  -  5-hydroxytryptamine (serotonin) receptor 2b, g protein-coupled, FGF4  -  fibroblast growth factor 4, ADA  -  adenosine deaminase, ARHGDIA  -  rho gdp dissociation inhibitor (gdi) alpha, MED1  -  mediator complex subunit 1, CEBPB  -  ccaat/enhancer binding protein (c/ebp), beta, AMIGO2  -  adhesion molecule with ig-like domain 2, KRT18  -  keratin 18, ROCK1  -  rho-associated, coiled-coil containing protein kinase 1, DAPK1  -  death-associated protein kinase 1, MAPK8IP1  -  mitogen-activated protein kinase 8 interacting protein 1, TCF7L2  -  transcription factor 7-like 2 (t-cell specific, hmg-box), EDNRA  -  endothelin receptor type a, TRAF2  -  tnf receptor-associated factor 2, HDAC1  -  histone deacetylase 1, TPT1  -  tumor protein, translationally-controlled 1, IRAK1  -  interleukin-1 receptor-associated kinase 1, IFIT3  -  interferon-induced protein with tetratricopeptide repeats 3, TLE1  -  transducin-like enhancer of split 1 (e(sp1) homolog, drosophila), AGT  -  angiotensinogen (serpin peptidase inhibitor, clade a, member 8), GPI  -  glucose-6-phosphate isomerase, UNG  -  uracil-dna glycosylase, CAST  -  calpastatin, CTSH  -  cathepsin h, ID1  -  inhibitor of dna binding 1, dominant negative helix-loop-helix protein, NGF  -  nerve growth factor (beta polypeptide), NFKBIA  -  nuclear factor of kappa light polypeptide gene enhancer in b-cells inhibitor, alpha, WNT5A  -  wingless-type mmtv integration site family, member 5a, TSC22D3  -  tsc22 domain family, member 3, TEK  -  tek tyrosine kinase, endothelial, MSH2  -  muts homolog 2, colon cancer, nonpolyposis type 1 (e. coli), SHH  -  sonic hedgehog, BAG1  -  bcl2-associated athanogene, JUN  -  jun proto-oncogene, GPX1  -  glutathione peroxidase 1, PRNP  -  prion protein, CRYAB  -  crystallin, alpha b, ARNT2  -  aryl-hydrocarbon receptor nuclear translocator 2, CCNG1  -  cyclin g1, ATF5  -  activating transcription factor 5, NFE2L2  -  nuclear factor (erythroid-derived 2)-like 2, JAK2  -  janus kinase 2, TYRO3  -  tyro3 protein tyrosine kinase, RPS6KA3  -  ribosomal protein s6 kinase, 90kda, polypeptide 3, SFRP1  -  secreted frizzled-related protein 1, IGF1R  -  insulin-like growth factor 1 receptor, MAPK7  -  mitogen-activated protein kinase 7, SERPINB9  -  serpin peptidase inhibitor, clade b (ovalbumin), member 9, CAT  -  catalase, FADD  -  fas (tnfrsf6)-associated via death domain, BCL6  -  b-cell cll/lymphoma 6, KRIT1  -  krit1, ankyrin repeat containing, CFDP1  -  craniofacial development protein 1, PRKCG  -  protein kinase c, gamma, SLC25A4  -  solute carrier family 25 (mitochondrial carrier; adenine nucleotide translocator), member 4, SMAD3  -  smad family member 3, PRKCA  -  protein kinase c, alpha, GSK3B  -  glycogen synthase kinase 3 beta, SMAD6  -  smad family member 6, CBS  -  cystathionine-beta-synthase, GAS6  -  growth arrest-specific 6, ITSN1  -  intersectin 1 (sh3 domain protein), GAS1  -  growth arrest-specific 1]"GO:0043066,negative regulation of apoptotic process,1.13E-07,2.52E-04,1.75,8230,522,892,99,"[BNIP3  -  bcl2/adenovirus e1b 19kda interacting protein 3, DDX3X  -  dead (asp-glu-ala-asp) box helicase 3, x-linked, BNIP2  -  bcl2/adenovirus e1b 19kda interacting protein 2, MIF  -  macrophage migration inhibitory factor (glycosylation-inhibiting factor), PAX7  -  paired box 7, CD59  -  cd59 molecule, complement regulatory protein, PSMA1  -  proteasome (prosome, macropain) subunit, alpha type, 1, HRAS  -  harvey rat sarcoma viral oncogene homolog, FOXO1  -  forkhead box o1, ASIC2  -  acid-sensing (proton-gated) ion channel 2, FOXC1  -  forkhead box c1, PSMA6  -  proteasome (prosome, macropain) subunit, alpha type, 6, CRLF1  -  cytokine receptor-like factor 1, PSMB10  -  proteasome (prosome, macropain) subunit, beta type, 10, SOX9  -  sry (sex determining region y)-box 9, PDCD10  -  programmed cell death 10, PSMB9  -  proteasome (prosome, macropain) subunit, beta type, 9, PSMB8  -  proteasome (prosome, macropain) subunit, beta type, 8, NACA  -  nascent polypeptide-associated complex alpha subunit, PSMB4  -  proteasome (prosome, macropain) subunit, beta type, 4, APOE  -  apolipoprotein e, SOD2  -  superoxide dismutase 2, mitochondrial, SOD1  -  superoxide dismutase 1, soluble, SERPINE1  -  serpin peptidase inhibitor, clade e (nexin, plasminogen activator inhibitor type 1), member 1, PSMD8  -  proteasome (prosome, macropain) 26s subunit, non-atpase, 8, IL6ST  -  interleukin 6 signal transducer (gp130, oncostatin m receptor), BMP4  -  bone morphogenetic protein 4, AQP1  -  aquaporin 1 (colton blood group), ITGA5  -  integrin, alpha 5 (fibronectin receptor, alpha polypeptide), PSMD11  -  proteasome (prosome, macropain) 26s subunit, non-atpase, 11, PSME1  -  proteasome (prosome, macropain) activator subunit 1 (pa28 alpha), MDK  -  midkine (neurite growth-promoting factor 2), CFL1  -  cofilin 1 (non-muscle), MECP2  -  methyl cpg binding protein 2 (rett syndrome), ADAR  -  adenosine deaminase, rna-specific, PDPK1  -  3-phosphoinositide dependent protein kinase-1, EGFR  -  epidermal growth factor receptor, HTR2B  -  5-hydroxytryptamine (serotonin) receptor 2b, g protein-coupled, FGF4  -  fibroblast growth factor 4, ADA  -  adenosine deaminase, ARHGDIA  -  rho gdp dissociation inhibitor (gdi) alpha, MED1  -  mediator complex subunit 1, CEBPB  -  ccaat/enhancer binding protein (c/ebp), beta, AMIGO2  -  adhesion molecule with ig-like domain 2, KRT18  -  keratin 18, ROCK1  -  rho-associated, coiled-coil containing protein kinase 1, DAPK1  -  death-associated protein kinase 1, MAPK8IP1  -  mitogen-activated protein kinase 8 interacting protein 1, TCF7L2  -  transcription factor 7-like 2 (t-cell specific, hmg-box), EDNRA  -  endothelin receptor type a, TRAF2  -  tnf receptor-associated factor 2, HDAC1  -  histone deacetylase 1, TPT1  -  tumor protein, translationally-controlled 1, IRAK1  -  interleukin-1 receptor-associated kinase 1, IFIT3  -  interferon-induced protein with tetratricopeptide repeats 3, TLE1  -  transducin-like enhancer of split 1 (e(sp1) homolog, drosophila), AGT  -  angiotensinogen (serpin peptidase inhibitor, clade a, member 8), GPI  -  glucose-6-phosphate isomerase, UNG  -  uracil-dna glycosylase, CAST  -  calpastatin, CTSH  -  cathepsin h, ID1  -  inhibitor of dna binding 1, dominant negative helix-loop-helix protein, NGF  -  nerve growth factor (beta polypeptide), NFKBIA  -  nuclear factor of kappa light polypeptide gene enhancer in b-cells inhibitor, alpha, WNT5A  -  wingless-type mmtv integration site family, member 5a, TSC22D3  -  tsc22 domain family, member 3, TEK  -  tek tyrosine kinase, endothelial, MSH2  -  muts homolog 2, colon cancer, nonpolyposis type 1 (e. coli), SHH  -  sonic hedgehog, BAG1  -  bcl2-associated athanogene, JUN  -  jun proto-oncogene, GPX1  -  glutathione peroxidase 1, PRNP  -  prion protein, CRYAB  -  crystallin, alpha b, ARNT2  -  aryl-hydrocarbon receptor nuclear translocator 2, CCNG1  -  cyclin g1, ATF5  -  activating transcription factor 5, NFE2L2  -  nuclear factor (erythroid-derived 2)-like 2, JAK2  -  janus kinase 2, TYRO3  -  tyro3 protein tyrosine kinase, RPS6KA3  -  ribosomal protein s6 kinase, 90kda, polypeptide 3, SFRP1  -  secreted frizzled-related protein 1, IGF1R  -  insulin-like growth factor 1 receptor, MAPK7  -  mitogen-activated protein kinase 7, SERPINB9  -  serpin peptidase inhibitor, clade b (ovalbumin), member 9, CAT  -  catalase, FADD  -  fas (tnfrsf6)-associated via death domain, BCL6  -  b-cell cll/lymphoma 6, KRIT1  -  krit1, ankyrin repeat containing, CFDP1  -  craniofacial development protein 1, PRKCG  -  protein kinase c, gamma, SMAD3  -  smad family member 3, PRKCA  -  protein kinase c, alpha, GSK3B  -  glycogen synthase kinase 3 beta, SMAD6  -  smad family member 6, CBS  -  cystathionine-beta-synthase, GAS6  -  growth arrest-specific 6, ITSN1  -  intersectin 1 (sh3 domain protein), GAS1  -  growth arrest-specific 1]"